BSF officer[comma] 27[comma] killed in 6 serial blasts by Maoists in Chhattisgarh,In Pune[comma] those who spit on roads will now have to clean it,India’s help in World War 1 rewarded with harsh laws[comma] writes Shashi Tharoor,‘No use against pollution[comma]’ docs fume over distribution of cloth masks,Madhya Pradesh polls 2018: Parties weigh in caste as tickets are allotted
Nov 11[comma] 2018 09:58 IST,India’s help in World War 1 rewarded with harsh laws[comma] writes Shashi Tharoor
Nov 11[comma] 2018 14:36 IST,Thugs Of Hindostan fails to impress Twitter[comma] trolled with jokes[comma] memes
Nov 08[comma] 2018 15:55 IST,India among nations expected to push for China-backed deal excluding US
Nov 11[comma] 2018 11:22 IST,On Baazigar’s 25th anniversary[comma] director Mustan shares SRK stories
Nov 11[comma] 2018 15:01 IST,Samsung W2019 flip phone launched: Price[comma] full specifications[comma] features
Nov 11[comma] 2018 13:15 IST,LPG price hiked by over Rs 2 after rise in dealers’ commission
Nov 10[comma] 2018 16:56 IST,Isha Ambani[comma] Anand Piramal’s wedding invitation card looks regal
Nov 11[comma] 2018 14:16 IST,Australia vs South Africa 3rd ODI[comma] LIVE updates: SA post 320 in decider
Nov 11[comma] 2018 12:29 IST,Delhi woman claims Sikh man ‘hypnotised’[comma] dupes her of Rs 4[comma]000
Nov 11[comma] 2018 12:17 IST,Traffic restored on Mumbai-Ahmedabad line 13 hours after goods train fire
Nov 09[comma] 2018 14:20 IST,Is it impossible to cheat in computer based examinations?
Nov 08[comma] 2018 17:29 IST,BSF officer[comma] 27[comma] killed in 6 serial blasts by Maoists in Chhattisgarh,‘Thugs of Hindostan’ screening in Jaipur hall cancelled due to Cong meet,Telangana election 2018: In KCR stronghold[comma] voters divided over his performance,Indian response to World War 1 variegated[comma] literature reflects that,Indians in WW1 were fighting someone else’s war: Capt Amarinder Singh,Duty and loyalty on display in the First World War,Sarkar review: Vijay returns to solve Tamil Nadu’s problems but can’t,Baazaar movie review: Saif stands tall[comma] but this film’s stock tanks,Halloween review: I’ll haunt you in your sleep[comma] don’t watch it alone,‘Paradise is gone’: California fires devastate communities,US[comma] UK[comma] Canada denounce dissolution of Sri Lanka parliament as undemocratic,Authorities say they have stopped searching for victims of Lion Air flight,Bigg Boss 12 elimination poll: Viewers want Somi Khan gone from the house,Janhvi Kapoor[comma] Arjun Kapoor come together for dad Boney Kapoor’s birthday,How to make your smartphone’s battery last longer,Samsung to make at least 1 million foldable phones: Report,Amazon will soon stop using Oracle software for database management,Amazon strikes deal with Apple to sell iPhones[comma] iPads,India plans to export 2 mn tonnes of sugar to China from next year: Govt,Arun Jaitley says Mastercard[comma] Visa losing out to UPI[comma] RuPay in India,Tesla replaces Elon Musk[comma] names Robyn Denholm as Chair,You are on your way to becoming a narcissist by posting a lot of selfies,Pedal desks may reduce health risks of sedentary workplace,100 Years of World War 1: War posters discovered at US library,ICC Women’s World T20: St Lucia fixtures could be moved to Antigua,Alcacer fires Dortmund past Bayern to maintain Bundesliga lead,Red-hot number one Momota wins badminton’s China Open,Dramatic rise in farm fires[comma] air quality levels may hit emergency in Delhi,Delhi BJP claims Arvind Kejriwal in Dubai with ‘hidden agenda’,Over 450 medium[comma] heavy goods vehicles denied entry into Delhi,Shiv Sena demands name change of Osmanabad and Aurangabad,Beginning today[comma] expect Mumbai’s air to be ‘very poor’ for next 3 days,Dad said he’d disown me if I was involved in 26/11: Rahul Bhatt,IIM Calcutta records 100% placements,Mapping the growth of digital learning in India,Will your child be a future ‘consumer’ or ‘maker’?,Statues are always political. This is true of the Statue of Unity just as it is true of the Shiv Smarak[comma] the planned Ram statue[comma] and many other statues built by political leaders over the past several decades. Given recent developments[comma] it’s possible that political leaders across the country could......read more,Chanakya,Donald Trump’s political talents should not be underestimated[comma] and many presidents[comma] including Obama[comma] have recovered from midterm defeats to win re-election[comma] sometimes easily....read more,Ian Bremmer,Maybe this is too much to hope for[comma] but what a mighty leap it would be for India both economically and socially to invest in capacity and skill building for women to combat climate change...read more,Lalita Panicker,Follow us on:,Mining baron Janardhana Reddy[comma] aide arrested in alleged bribery case,Storm Gaja to turn severe[comma] lash north Tamil Nadu[comma] south Andhra coasts: IMD,‘Paradise is gone’: California fires devastate communities,Indians in WW1 were fighting someone else’s war: Capt Amarinder Singh,Iconic cartoon characters to keep your kids entertained this weekend!
Sponsored Content,Over 70 nations[comma] 70 million troops[comma] 52-month long: World War 1 in numbers,Before Deepika-Ranveer’s wedding[comma] her team shares pictures from Italy,Janhvi Kapoor[comma] Arjun Kapoor come together for dad Boney Kapoor’s birthday,Thugs of Hindostan box office day 3: Aamir’s film makes approx Rs 100 cr,After Priyanka’s bachelorette party[comma] Nick Jonas has his bachelor party,6 things to look forward to in Koffee With Karan with Varun[comma] Katrina,Virat Kohli reveals the main reason behind his prolific run with the bat,Baliyatra[comma] the little known connection between India and Indonesia,Colour happy: Browns for all seasons and occasions,WW1 Anniversary: 6 things you must know about the First World War,Watch: What was happening in Indian nationalism during World War 1,WWI Anniversary: Remembering the Indians who fought in World War 1,Guard escapes unhurt as train starts moving,PM ਮੋਦੀ ਆਪਣੀ ਸੰਸਦੀ ਸੀਟ ਬਨਾਰਸ ਨੂੰ ਦੇਣਗੇ ਢਾਈ ਹਜ਼ਾਰ ਕਰੋੜ ਦੇ ਤੋਹਫ਼ੇ,ਇਟਲੀ 'ਚ ਦੀਪਿਕਾ-ਰਣਵੀਰ ਦੇ ਵਿਆਹ ਦੀ ਤਿਆਰੀਆਂ ਸ਼ੁਰੂ,ਕੁਸ਼ਵਾਹਾ ਦੀ ਪਾਰਟੀ ਨੇ ਬਿਹਾਰ 'ਚ ਫਸਾਇਆ ਸੀਟ ਵੰਡ 'ਤੇ ਪੇਚਾ,ਰਾਜਸਥਾਨ : ਸਿਹਤ ਵਿਭਾਗ ਨੇ 49 ਡਾਕਟਰਾਂ ਨੂੰ ਫਰਾਰ ਐਲਾਨਿਆ,Statues are political ideals cast in stone,How will the new reality in Washington influence Trump’s foreign policy?,Near total exclusion of women from decision-making on climate change,India vs West Indies: India’s predicted XI for 3rd T20I; multiple changes expected,India vs West Indies: Kieron Pollard – Numbers reveal WI stalwart is living on borrowed time,How World War 1 shaped the 20th century and beyond,PM Modi should accept demonetisation was wrong[comma] writes Rajdeep Sardesai,Twist in the tale: The dilemma that Maneka Gandhi faces,Diwali celebrations and the manhunt for Avni: India this week,Indian response to World War 1 variegated[comma] literature reflects that,World War 1: Indians wore cotton khakis in winter[comma] many died of cold,When a Sikh sepoy saved a British 2nd Lieutenant’s life in World War 1,Move over Batman[comma] Bajrangi takes on supervillains,Kapoor family is selling the iconic RK Studios[comma] Rishi Kapoor confirms,Shy and intelligent: IIT professors remember Google CEO Sundar Pichai,Every Marvel fan will weep at this viral Avengers 4 ending proposed by fan,Why girls at Deoria’s shelter home dreaded the weekends,Calls to allies[comma] team to execute plan: How NDA won Rajya Sabha battle,Photos: Deadly wildfire levels a California town in less than a day,Photos of the week: Tihar in Nepal and US midterm elections,Photos: Living by Ho Chi Minh city’s serpentine ‘black canals’,